{
  "tag": "v0.4-research-alpha",
  "commit": "b66347530624c784fb64bbb19a5775849aca8a6c",
  "ci_run_id": "27288041752",
  "acceptance_report_path": "artifacts/r8_acceptance_report.json",
  "benchmark_artifact_paths": [
    "artifacts/benchmarks.md",
    "artifacts/r8_3_falsification_benchmarks.md",
    "artifacts/r8_3_crossover_surface.csv"
  ],
  "research_only_disclaimer": "This release contains theoretical, simulator-only research abstractions for thermodynamic computing and Landauer limit analysis. Deployed hardware architectures do not support physical reversible execution, and this model remains strictly decoupled from production control loops."
}
